Title,Link,Official Link,Deadline,Eligibility,Host Country,Host University,Program Duration,Degree Offered
Mandela Rhodes Scholarship for African Students 2026 | Fully Funded,https://scholarshipscorner.website/mandela-rhodes-scholarship-for-african-students/,https://mandela-rhodes.embark.com/login/apply?target=2026&_gl=1*2uy8j4*_ga*MTY1MjAwMzk1MC4xNzQyMjQzMjY3*_ga_TWL8GTPF51*MTc0MjI0MzI2Ni4xLjEuMTc0MjI0MzM0My42MC4wLjA.,"All interested candidates can apply till21 April 2025.
Apply NowOfficial LinkJoin our WhatsApp Channel","Open to citizens of any African country.Applicants must be between 19 and 29 years old at the time of application.Must have a strong academic record, typically above 70% or upper-second class Honours.The scholarship is for postgraduate studies (Honours or Master’s degrees) in South African universities.You can apply if you are completing your undergraduate degree this year, but you must have your degree by January 1, 2026.Must be able to study in English, as all South African universities use English as the medium of instruction.",South Africa,,Honours Degree Program-1 yearMaster’s Degree Program-2 years,Honours Degree ProgramMaster’s Degree Program
Global Opportunities with deadlines in October 2024,https://scholarshipscorner.website/global-opportunities-with-deadlines-in-october/,https://scholarshipscorner.website/how-to-apply-for-chevening-scholarship/,,,,,,
International opportunities with deadlines in September 2024,https://scholarshipscorner.website/international-opportunities-with-deadlines-in-september/,,,,,,,
MEPI Tomorrow’s Leaders Program 2024-25 | Fully Funded,https://scholarshipscorner.website/mepi-tomorrows-leaders-program/,https://fhi360educationprograms.my.site.com/s/login/?ec=302&startURL=%2Fs%2F,,Medical school students are not eligible to apply.IELTS and TOEFL test scores are not needed at the time of submitting the application. You will need them later on if you get selected after interview.S. citizens and U.S. legal permanent residents cannot apply.Applicants should have 80% marks in previous academic history.Candidates should belong to one of the countries mentioned below.Graduate applicants have to complete and submit two separate applications while apply to the American University of Beirut and the American University in Cairo. One will be Tomorrow’s Leaders Program graduate application and the other will be separate application to the partner institution.,,,4 years of undergraduate and 2 years of graduate program.,
Fulbright Scholar Program for Pakistan 2025 in the USA | Fully Funded,https://scholarshipscorner.website/fulbright-scholar-program-for-pakistan/,https://www.usefp.org/scholarships/fulbright-scholar.cfm,"The last date to submit the application isSeptember 18, 2024.
Apply NowOfficial Link",,United States of America,,The duration of the Fulbright scholarship in the USA is up to 12 months,
UP Commonwealth Scholarship in South Africa | Fully Funded,https://scholarshipscorner.website/up-commonwealth-scholarship-south-africa/,https://www.up.ac.za/funding/3237135/2025-up-doctoral-commonwealth-scholarship,"The last date to apply is11thSeptember, 2024.
Apply NowOfficial Link","Applicants applying must:
Be citizens of Commonwealth countries excluding South Africans.Acquire their studies at the University of Pretoria and start in 2025.Submit an application to study at UP in 2025 academic year.Have selected a potential supervisor.Submit their academic records to the South African Qualification Authority (SAQA).Have completed their postgraduate/Masters degree in the previous two years to apply to UP for admission in 2025.Not be older than 40 years.PhD and Masters students who are registered or who have previously studied at the University of Pretoria can not apply for this scholarship.",South Africa,,3 years,
Fully Funded Scholarships for International Students 2024,https://scholarshipscorner.website/fully-funded-scholarships-for-international-students/,,,,,,,
Mastercard Foundation Scholarship at University of Pretoria | Fully Funded,https://scholarshipscorner.website/mastercard-foundation-scholarship-university-of-pretoria/,https://www.up.ac.za/mastercard-foundation-scholarship-program/article/3080545/about-mcfsp-up,"The deadline to submit the application is30th August 2023.
Apply NowOfficial Link","African Nationality:
Candidates must be African nationals.
Bachelor’s Degree:
Candidates must have a bachelor’s degree and possess excellent academic background.
Financial Needs:
Candidates need to provide information about their financial situation to be considered for studying abroad.
Leadership and Community Service experience:
Candidates must possess strong leadership and community service experience.
Checkthe list of Scholarships in Germany for International Students",South Africa,,,
List of the Top Scholarships for African Students 2023-24,https://scholarshipscorner.website/scholarships-african-students/,,,,,,,
Top 10 Affordable Countries to Study Abroad in 2022-2023,https://scholarshipscorner.website/top-10-affordable-countries-study-abroad/,,,,"Among all Nordic countries, Norway is beings considered an affordable destination for getting an internationally recognized education. Norway welcomes everyone from all regions, whether you belong to the nations inside the horizon of the European Union or outside of it. Every public university in Norway is ready to welcome you with open arms. Moreover, it is breathtaking that Norway, being a European country, is known for providing a high quality of life to its residents through its striking natural beauty. One of the smart features of Norway’s educational system is that the medium of instruction is English so it is easier for the students, proficient in English to apply and get selected there. If you are not availing of thefully-funded scholarshipthere, you should keep in mind that the cost of living is comparatively high.
CheckScholarships in Norway without IELTS",,,
